1907,ডঃ সৈয়দ মাহবু্বুর রহমান,প্রধান,কম্পিউটার সায়েন্স এন্ড ইঞ্জিনিয়ারিং কৌশল বিভাগ
1908,"ডঃ এ,এস,ওয়াইস কারনী",প্রধান,বস্তু ও ধাতব কৌশল বিভাগ
1909,ডঃ মোঃ আলী আসগর,প্রধান,পদার্থ বিঞ্জান বিভাগ
1910,ডঃ মোঃ খোরশেদ আলম,প্রধান,পানিসম্পদ কৌশল বিভাগ
1911,জনাব মোঃ খায়রুল এনাম,প্রধান,স্থাপত্য কৌশল বিভাগ
1912,ডঃ মোঃ জসিম উজ-জামান,প্রফেসর,কেমিকৌশল বিভাগ
1913,ডঃ সৈয়দ ফজলে রহমান,প্রফেসর,তড়িৎ ও ইলেকট্রনিক কৌশল বিভাগ
1914,ডঃ আবদুল হান্নান,প্রফেসর,পানিসম্পদ কৌশল বিভাগ
1915,ডঃ দীপক কান্তিদাশ,প্রফেসর,যন্ত্রকৌশল বিভাগ
1916,"ডঃ এস,এম নজরুল ইসলাম",প্রফেসর,যন্ত্রকৌশল বিভাগ
1917,ডঃ আইনুন নিশাত,প্রফেসর,পানিসম্পদ কৌশল বিভাগ
1918,"ডঃ কে, ইখতিয়ার ওমর",প্রফেসর,কেমিকৌশল বিভাগ
1919,ডঃ তফাজ্জেল হোসেন,প্রধান,পদার্থ বিঞ্জান বিভাগ
1920,"ডঃ এ,কে,এম, জহির উদ্দিন চৌধুরী",রিসার্চ প্রফেসর,"আই,এফ,সি,ডি,আর"
1921,ডঃ মোঃ আব্দু রউফ,প্রফেসর,পুরকৌশল বিভাগ
1922,"ডঃ এম,এম, তওফিকুল আনোয়ার",সহযোগী অধ্যাপক,পুরকৌশল বিভাগ
1923,ডঃ মোঃ নজরুল ইসলাম,রিসার্চ সহযোগী অধ্যাপক,ইনষ্টিটিউট অফ এপ্রোপ্রিয়েট টেকনোলজি বিভাগ
1924,"ডঃ এ,কে,এম, নুরুল আমিন",সহযোগী অধ্যাপক,ইন্ডাষ্ট্রিয়াল এন্ড প্রোডাকশন ইঞ্জিনিয়ারিং বিভাগ
1925,"ডঃ এ,কে,এম, সদরুল ইসলাম",সহযোগী অধ্যাপক,যন্ত্রকৌশল বিভাগ
1926,ডঃ মোঃ সাদিকুল বারী,সহযোগী অধ্যাপক,নৌযান ও নৌযন্ত্রকৌশল বিভাগ
1927,জনাব খবীরুল হক চৌধুরী,সহযোগী অধ্যাপক,নৌযান ও নৌযন্ত্রকৌশল বিভাগ
1928,ডঃ স্বপন কুমার দে,সহযোগী অধ্যাপক,নৌযান ও নৌযন্ত্রকৌশল বিভাগ
1929,ডঃ মোঃ মুজিবুল রহমান,সহযোগী অধ্যাপক,পুরকৌশল বিভাগ
1930,"ডঃ এ,কে,এম, আবদুল মোক্তবদির",সহযোগী অধ্যাপক,পুরকৌশল বিভাগ
1931,ডঃ সৈয়দ ফকরুল আমিন,সহযোগী অধ্যাপক,পুরকৌশল বিভাগ
1932,"ডঃ এম,এ, মোহিত",সহযোগী অধ্যাপক,নগর ও অঞ্চল পরিকল্পনা বিভাগ
1933,ডঃ মনিমুল হক,সহযোগী অধ্যাপক,পদার্থ বিঞ্জান বিভাগ
1934,"ডঃ এ,এ,মোঃ রেজাউল হক",সহযোগী অধ্যাপক,ধাতব কৌশল বিভাগ
1935,পরিচালক,পরিচালক,ইনস্টিটিউট অব এ্যপ্রোপ্রিয়েট টেকনোলোজী
1936,পরিচালক,পরিচালক,বন্যা নিয়ন্ত্রন ও পানি সম্পদ গবেষণা ইনস্টিটিউট
1937,লাইব্রেরীয়ান,লাইব্রেরীয়ান,বাংলাদেশ প্রকৌশল বিশ্ববিদ্যালয়
1938,ডঃ গিয়াস উদ্দিন আহমদ,ডীন,প্রকৌশল অনুষদ
1939,ডঃ মোঃ আলী মূর্তুজা,ডীন,পুর কৌশল অনুষদ
1940,ডঃ মোঃ আবু তাহের আলী,ডীন,যন্ত্র কৌশল অনুষদ
1941,ডঃ এ বি এম সিদ্দিক হোসেন,ডীন,তড়িৎ ও ইলেক ট্রনিক কৌশল অনুষদ
1942,ডঃ সৈয়দ মাহবুবুর রহমান,প্রধান,কম্পিউটার সায়েন্স এন্ড ইঞ্জিনিয়ারিং কৌশল বিভাগ
1943,ডঃ মুহাম্মদ জকেরউল্ল্যাহ,প্রধান,গণিত বিভাগ
1944,ডঃ এ এস ওয়াইস কারনী,প্রধান,বস্তু ও ধাতব কৌশল বিভাগ
1945,ডঃ ফিরোজ আহমেদ,প্রধান,পুরকৌশল বিভাগ
1946,ডঃ মোঃ জসিম উজ জামান,প্রফেসর,কেমিকৌশল বিভাগ
1947,ডঃ এ এম আজিজ উল হক,প্রফেসর,যন্ত্রকৌশল বিভাগ
1948,ডঃ এস এম নজরূল ইসলাম,প্রফেসর,যন্ত্রকৌশল বিভাগ
1949,ডঃ এহসান হক,প্রফেসর,বস্তু ও ধাতব কৌশল বিভাগ
1717,জনাব শাহ আলম জহিরুদ্দিন,"অতিরিক্ত প্রধান স্থপতি,বাঃ সরকার",অন্যান্য
1718,"মেজর জেনারেল এফ, আর, আল-মামুন","সচিব,গণপূর্ত ও নগর উন্নয়ন মন্ত্রণালয়",অন্যান্য
1719,"ডঃ এ, মতিন","প্রজেক্ট ডাইরেকটর,বাংলাদেশ আনবিক শক্তি কমিশন",অন্যান্য
1754,ডঃ মোঃ নুরুল ইসলাম,সহযোগীপ্রফেসর,কেমিকৌশল বিভাগ
1950,ডঃ মোঃ আঃ হালিম,প্রফেসর,পানিসম্পদ কৌশল বিভাগ
1951,ডঃ তোফাজ্জল হোসেন,প্রফেসর,পদার্থ বিঞ্জান বিভাগ
1952,"ডঃ এ,কে,এম জহির উদ্দিন চৌধুরী",রিসার্চ প্রফেসর,ইনষ্টিটিউট অফ এপ্রোপ্রিয়েট টেকনোলজি
1953,ডঃ মোঃ রাজ্জাক আকন্দ,প্রফেসর,যন্ত্রকৌশল বিভাগ
1955,ডঃ শহীদুল ইসলাম ৎআমিন,সহযোগী অধ্যাপক,তড়িৎ ও ইলেকট্রনিক কৌশল বিভাগ
1956,ডঃ মোঃ রেফায়েত উল্লাহ,সহযোগী অধ্যাপক,নৌযান ও নৌযন্ত্রকৌশল বিভাগ
1957,ডঃ মোঃ সামসুল আলম,সহযোগী অধ্যাপক,কম্পিউটার সায়েন্স এন্ড ইঞ্জিনিয়ারিং কৌশল বিভাগ
1958,ডঃ তাইফুর আহমেদ  চৌধুরী,সহযোগী অধ্যাপক,তড়িৎ ও ইলেকট্রনিক কৌশল বিভাগ
1959,"ডঃ কে, এ,এম, আবদুল মোক্তাদির",সহযোগী অধ্যাপক,পুরকৌশল বিভাগ
1960,ডঃ মমিনুল হক,সহযোগী অধ্যাপক,পদার্থ বিঞ্জান বিভাগ
1961,জনাব গোলাম মহিউদ্দন,সহযোগী অধ্যাপক,ইন্ডাষ্ট্রিয়াল এন্ড প্রোডাকশন ইঞ্জিনিয়ারিং বিভাগ
1962,পরিচালক,পরিচালক,বন্যানিয়ন্ত্রন ও পানি নিস্কাশন গবেষনা ইনষ্টিটিউট
1963,জনাব আবু হায়দার ইমাম উদ্দিন,প্রফেসর,"স্থাপত্য ও পরিকল্পনা অনুষদ
ডঃ মোঃ আলী মূর্তুজা"
1964,ডঃ মীর নাজমুল করীম,প্রধান,মানবিক বিভাগ
1965,ডঃ মীর ওয়াহাজ উদ্দিন,প্রধান,যন্ত্রকৌশল বিভাগ
1966,ডঃ সোহরাব উদ্দিন আহমেদ,প্রফেসর,"পুরকৌশল বিভাগ
ডঃ জামিলুর রেজা চৌধুরী"
1967,জনাব মীর মোবাশ্বের আলী,প্রফেসর,স্থাপত্য কৌশল বিভাগ
1968,ডঃ  মোঃ সামিম-উজ-জামান বসুনিয়া,প্রফেসর,পুরকৌশল বিভাগ
1969,ডঃ দীপককান্তি দাশ,প্রফেসর,যন্ত্রকৌশল বিভাগ
1970,ডঃ এস এম নজরুল ইসলাম,প্রফেসর,যন্ত্রকৌশল বিভাগ
1971,ডঃ মোঃ  মুজিবুর রহমান,সহযোগী প্রফেসর,তড়িৎ ও ইলেকট্রনিক কৌশল বিভাগ
1972,ডঃ ইখতিয়ার ওমর,প্রফেসর,কেমিকৌশল বিভাগ
1973,ডঃ মোঃ আব্দুল মতিন,প্রফেসর,তড়িৎ ও ইলেকট্রনিক কৌশল বিভাগ
1974,ডঃ  মোঃ কামরুল ইসলাম,প্রফেসর,যন্ত্রকৌশল বিভাগ
1975,জনাব মোঃ আলী আশরাফ,সহযোগী প্রফেসর,গণিত বিভাগ
1976,জনাব ফারুক আহমেদ উল্লাহ খান,সহযোগী প্রফেসর,স্থাপত্য বিভাগ
1977,মিসেস খালেদা রশীদ,সহযোগী প্রফেসর,স্থাপত্য বিভাগ
1978,"(আই,এফ,সি,ডি,আর) 
ডঃ এ,কে,এম, নুরুল আমিন",সহযোগী অধ্যাপক,ইন্ডাষ্ট্রিয়াল এন্ড প্রোডাকশন ইঞ্জিনিয়ারিং বিভাগ
1979,ডঃ কাজী মহি উদ্দিন আহম্মেদ,সহযোগী অধ্যাপক,তড়িৎ ও ইলেকট্রনিক কৌশল বিভাগ
1980,ডঃ এ.কে.এম. সদরুল ইসলাম,সহযোগী প্রফেসর,যন্ত্রকৌশল বিভাগ
1981,ডঃ আহসান আলী খান,সহযোগী প্রফেসর,ইন্ডাষ্ট্রিয়াল এন্ড প্রোডাকশন ইঞ্জিনিয়ারিং বিভাগ
1982,ডঃ মোঃ শহীদুল আমিন,সহযোগী অধ্যাপক,স্থাপত্য বিভাগ
1983,ডঃ এম.এম. শহিদুল হাসান,সহযোগী অধ্যাপক,তড়িৎ ও ইলেকট্রনিক কৌশল বিভাগ
1984,ডঃ এ.এ. মোঃ রেজাউল হক,সহযোগী অধ্যাপক,বস্তু ও ধাতব কৌশল বিভাগ
1985,"ডঃ এস,এস লুৎফুল কবীর",সহযোগী অধ্যাপক,তড়িৎ ও ইলেকট্রনিক কৌশল বিভাগ
1986,সভাপতি,বাংলাদেশ ইনষ্টিটিউট অব ইন্ঞ্জিনিয়ার্স ঢাকা,অন্যান্য
1987,ডঃ এবিএম সিদ্দিক হোসেন,প্রধান,কম্পিউটার সায়েন্স এন্ড ইঞ্জিনিয়ারিং কৌশল বিভাগ
1988,জনাব মীর ওয়াহাজ উদ্দিন,প্রধান,যন্ত্রকৌশল বিভাগ
1989,ডঃ মোঃ আঃ আকন্দ,প্রফেসর,যন্ত্রকৌশল বিভাগ
1768,ডঃ আ. খ. ম. মাহফুজুর রহমান খান,সহযোগী অধ্যাপক,তড়িৎ ও ইলেকট্রনিক কৌশল বিভাগ
1789,ডঃ মোঃ শামিমউজ্জামান,সহযোগী প্রফেসর,পুরকৌশল বিভাগ
1794,ডঃ আঃ বাতেন খাঁন,"সদস্য,আনবিক শক্তি কমিশন",অন্যান্য
1797,ডঃ মোঃ আবদুল হান্নান,প্রফেসর,পানি সম্পদ কৌশল বিভাগ
1809,ডঃ মোঃ মিজানুর রহমান,পরিচালক,উপদেশ প্রসারণ ও গবেষণা কার্যক্রম পরিদপ্তর
1954,ডঃ মোঃ মনোয়ারুর ইসলাম,সহযোগী অধ্যাপক,রসায়ন বিভাগ
1990,ডঃ মোঃ ইখতিয়াজ হোসেন,প্রফেসর,যন্ত্রকৌশল বিভাগ
1991,"জনাব আ,ফ,ম, আবদুর রউফ",সহযোগী প্রফেসর,পুরকৌশল বিভাগ
1992,"জনাব এ,এস,এম,মাহবুবু উন নবী",সহযোগী অধ্যাপক,"নগর ও অঞ্চল
জনাব ফারুক আহমেদ উল্লাহ খান"
1993,ডঃ আহসান কবির,সহযোগী অধ্যাপক,পুরকৌশল বিভাগ
1994,ডঃ এ.কে.এম. সদরুল ইসলাম,সহযোগী অধ্যাপক,যন্ত্রকৌশল বিভাগ
1995,"ডঃ এস,এস পুৎফুল কবীর",সহযোগী অধ্যাপক,তড়িৎ ও ইলেকট্রনিক কৌশল বিভাগ
1996,"ডঃ এ, এফ, এম আনোয়ারুল হক",প্রধান,ইন্ড্রাষ্ট্রিয়াল এন্ড প্রোডাকশন ইঞ্জিনিয়ারিং বিভাগ
1997,ডঃ মোঃ শামসুল আলম,প্রধান,কম্পিউটার সায়েন্স এন্ড ইঞ্জিনিয়ারিং বিভাগ
1998,"ডঃ এ, বি, এম, সিদ্দিক হোসেন",প্রধান,তড়িৎ ও ইলেকট্রনিক কৌশল বিভাগ
1999,ডঃ মোঃ মহাফিজুল হক,প্রধান,বস্তু ও ধাতব কৌশল বিভাগ
2000,ডঃ তফাজ্জল হোসেন,প্রধান,পদার্থ বিজ্ঞান বিভাগ
2001,"ডঃ এ, এম, এম, সফিউল্লাহ",প্রধান,পুরকৌশল বিভাগ
2002,জনাব আবু হায়দার ইমাম উদ্দীন,প্রধান,স্থাপত্য বিভাগ
2003,ডঃ ইজাজ হোসেন,প্রধান,পেট্রোলিয়াম এন্ড মেনারেল রিসোর্স ইঞ্জিনিয়ারিং
2004,"ডঃ এ, এম, আজিজ উল হক",প্রফেসর,যন্ত্রকৌশল বিভাগ
2005,ডঃ মোঃ শামীম উজ জামান বসুনিয়া,প্রফেসর,পুরকৌশল বিভাগ
2006,ডঃ মোঃ মিজানুর রহমান,প্রফেসর,ইন্ড্রাষ্ট্রিয়াল এন্ড প্রোডাকশন ইঞ্জিনিয়ারিং বিভাগ
2007,ডঃ এম ফিরোজ আহমেদ,প্রফেসর,পুরকৌশল বিভাগ
2008,ডঃ মোঃ ওয়াহাজ উদ্দিন,প্রফেসর,যন্ত্রকৌশল বিভাগ
2009,ডঃ মোঃ মোহর আলী বেপারি,প্রফেসর,বস্তু ও ধাতব কৌশল বিভাগ
2010,ডঃ গাজী মোঃ খলিল,প্রফেসর,নৌযান ও নৌযন্ত্র কৌশল বিভাগ
2011,"ডঃ এ, এ, মোঃ রেজাউল হক",প্রফেসর,বস্তু ও ধাতব কৌশল বিভাগ
2012,ডঃ মোঃ মমিনুল হক,রিসার্চ প্রফেসর,রসায়ন বিভাগ
2013,"ডঃ এ, কে, এম, সদরুল ইসলাম",প্রফেসর,যন্ত্র কৌশল বিভাগ
2014,ডঃ মোঃ নছরুল হক,প্রফেসর,বস্তু ও ধাতব কৌশল বিভাগ
2015,ডঃ এ এস এম আবদুল কাইয়ুম,সহযোগী অধ্যাপক,নগর ও অঞ্চল পরিকল্পনা বিভাগ
2016,ডঃ এস এম লুৎফুল কবীর,সহযোগী অধ্যাপক,তড়িৎ ও ইলেকট্রনিক কৌশল বিভাগ
2017,ডঃ মাগলুব আল নূর,সহযোগী অধ্যাপক,যন্ত্রকৌশল বিভাগ
2018,জনাব আব্দুর রহিম,সহযোগী অধ্যাপক,নৌযান ও নৌযন্ত্র কৌশল বিভাগ
2019,ডঃ এম মাইনুল হক,গবেষণা সহযোগী অধ্যাপক,ইনষ্টিটিউট অফ এপ্রোপ্রিয়েট টেকনোলজি বিভাগ
2020,ডঃ মোঃ আব্দুল মতিন,সহযোগী অধ্যাপক,পানি সম্পদ কৌশল বিভাগ
2021,ডঃ মোঃ হাবিবুর রহমান,সহযোগী অধ্যাপক,পুরকৌশল বিভাগ
2022,পরিচালক,"লাইব্রেরীয়ান,কেন্দ্রীয় লাইব্রেরী",অন্যান্য
2023,ডঃ মোঃ গোলাম রহমান,ডীন,স্থাপত্য ও পরিকল্পনা অনুষদ
2024,"ডঃ ইঞ্জিঃ এম, আনোয়ারুল য়াজীম",প্রফেসর,ইন্ড্রাষ্ট্রিয়াল এন্ড প্রোডাকশন ইঞ্জিনিয়ারিং বিভাগ
2025,ডঃ মুহাম্মদ জাকের উল্লাহ,প্রফেসর,গণিত বিভাগ
2026,মোঃ খোরশেদ আলম,প্রফেসর,পানি সম্পদ কৌশল বিভাগ
2027,ডঃ মোঃ খায়রুল এনাম,প্রফেসর,স্থাপত্য বিভাগ
2028,ডঃ মোঃ নজরুল ইসলাম,গবেষণা প্রফেসর,ইনষ্টিটিউট অফ এপ্রোপ্রিয়েট টেকনোলজি বিভাগ
1827,"Mr. S. M. Mazharul Haq
Dr. A. M. Zahoorul Haq",Professor,তড়িৎ ও ইলেকট্রনিক কৌশল বিভাগ
1829,"Dr. S. H. K. Yusufzai
Dr. Abul Hasnat
Mr. M. Kabiruddin
Dr. M. Azizul Islam
Dr. V. G. Desa",Head,যন্ত্রকৌশল বিভাগ
1835,"ডঃ এ, এম, আজিজ-উল-হক",ডীন,যন্ত্রকৌশল বিভাগ
1838,"ডঃ কে, ইখতিয়ার ওমর",প্রধান,কেমিকৌশল বিভাগ
1843,"ডঃ এ, এস, ওয়াইস কারনী",প্রফেসর,বস্তু ও ধাতব কৌশল বিভাগ
1846,লাইব্রেরীয়ান,কেন্দ্রীয় লাইব্রেরী,অন্যান্য
2029,"ডঃ আ, ফ,ম, আবদুর রউফ",সহযোগী অধ্যাপক,পুরকৌশল বিভাগ
2030,জনাব ফারুক আমেদ উল্লাহ খান,সহযোগী অধ্যাপক,নগর ও অঞ্চল পরিকল্পনা বিভাগ
2031,ডঃ মুঃ রিজওয়ান খান,সহযোগী অধ্যাপক,তড়িৎ ও ইলেকট্রনিক কৌশল বিভাগ
2032,ডঃ মোহাম্মদ আলী চৌধুরী,সহযোগী অধ্যাপক,তড়িৎ ও ইলেকট্রনিক কৌশল বিভাগ
2033,ডঃ মোঃ রুহুল আমীন সরকার,সহযোগী অধ্যাপক,ইন্ড্রাষ্ট্রিয়াল এন্ড প্রোডাকশন ইঞ্জিনিয়ারিং বিভাগ
2034,ডঃ মোঃ কায়কোবাদ,সহযোগী অধ্যাপক,কম্পিউটার সায়েন্স এন্ড ইঞ্জিনিয়ারিং বিভাগ
2035,ডঃ এ বি এম সিদ্দিক হোসেন,ডীন,"তড়িৎ ও ইলেক ট্রনিক কৌশল
ডঃ এবিএম সিদ্দিক হোসেন"
2036,জনাব নাজমুল করিম,প্রধান,মানবিক বিভাগ
2037,ডঃ সৈয়দ ফাজলে রহমান,প্রফেসর,তড়িৎ ও ইলেক ট্রনিক কৌশল বিভাগ
2038,ডঃ আলমগীর মুজিবুল হক,প্রফেসর,পুর কৌশল বিভাগ
2039,"ডঃ আ,খ, ম, আবদুল কাদের",প্রফেসর,কেমিকৌশল বিভাগ
2040,"ডঃ এ,কে,এম জহির উদ্দিন চৌধুরী",রিসার্চ প্রফেসর,"আই,এফ,সি,ডি,আর"
2041,ডঃ মোঃ মোজ্জামেল হক,রিসার্চ সহযোগী অধ্যাপক,"আ ই, এফ, সি, ডি, আর"
2042,ডঃ শহিদুল ইসলাম খান,সহযোগী অধ্যাপক,তড়িৎ ও ইলেকট্রনিক কৌশল বিভাগ
2043,ডঃ এম.এম. শহিদুল হাসান,সহযোগী অধ্যাপক,তড়িৎ ও ইলেক ট্রনিক কৌশল বিভাগ
2044,"ডঃ এস, এ, মোহিত",সহযোগী অধ্যাপক,নগর ও অঞ্চল পরিকল্পনা বিভাগ
2045,লাইব্রেরীয়ান,লাইব্রেরীয়ান,অন্যন্য
2046,জনাব মোঃ খবীরুল এনাম,ডীন,স্থাপত্য ও পরিকল্পনা অনুষদ
2047,"বাপ্রবি, ঢাকা।
ডঃ মোঃ আলী মূর্তুজা",ডীন,পুর কৌশল অনুষদ
2048,ডঃ মোঃ খোরশেদ আলম,প্রধান,পানি সম্পদ কৌশল বিভাগ
2049,ডঃ কে ইখতিয়ার ওমর,প্রধান,পেট্রোলিয়াম এন্ড মিনারেল রিসোর্সেস ইঞ্জিঃ বিভাগ
2050,ডঃ সোহরাব উদ্দিন আহামেদ,প্রফেসর,পুরকৌশল বিভাগ
2051,"ডঃ এ,এম আজিজ উল হক",প্রফেসর,যন্ত্রকৌশল বিভাগ
2052,ডঃ অালমগীর মুহিবুল হক,প্রফেসর,পুরকৌশল বিভাগ
2053,"ডঃ আ, খ, ম, আবদুল কদের",প্রফেসর,কেমিকৌশল বিভাগ
2054,"ডঃ এ, কে, এম, জহির উদ্দিন চৌধুরী",প্রফেসর,"আই,এফ,সি,ডি,আর"
2055,ডঃ মোঃ সবদার অালী,প্রফেসর,কেমি কৌশল বিভাগ
2056,জনাব মোঃ অালী আশরাফ,সহযোগী অধ্যাপক,গনিত বিভাগ
2057,জনাব অাজমল হায়াত আহমেদ,সহযোগী অধ্যাপক,নগর ও অঞ্চল পরিকল্পনা বিভাগ
2058,জনাব ফারুখ আহমেদ উল্লাহ খান,সহযোগী অধ্যাপক,স্থাপত্য বিভাগ
