2708,ডঃ মোঃ নজরুল ইসলাম,এসোসিয়েট ফেলো(ইন্জ্ঞিঃ),ইনষ্টিটিউট অফ ইনফরমেশন এন্ড কমিউনিকেশন টেকনোলজি
2751,ডঃ মোঃ জোবায়ের বিন আলম,সহযোগী অধ্যাপক,"আই, আই, সি, টি"
2752,ডঃ মোঃ আবদুল মতিন,অধ্যাপক,তড়িৎ ও ইলেকঃ কৌশল বিভাগ
2753,ডঃ সত্য প্রসাদ মজুমদার,অধ্যাপক,তড়িৎ ও ইলেকঃ কৌশল বিভাগ
2754,ডঃ আমিনুল হক,অধ্যাপক,তড়িৎ ও ইলেকঃ কৌশল বিভাগ
2755,ডঃ মোঃ সাইফুর রহমান,অধ্যাপক,তড়িৎ ও ইলেকঃ কৌশল বিভাগ
2756,ডঃ  প্রাণ কানাই সাহা,অধ্যাপক,তড়িৎ ও ইলেকঃ কৌশল বিভাগ
2757,ডঃ মোঃ আয়নাল হক,অধ্যাপক,তড়িৎ ও ইলেকঃ কৌশল বিভাগ
2758,ডঃ এ.বি.এম. হারুন-উর-রশিদ,অধ্যাপক,তড়িৎ ও ইলেকঃ কৌশল বিভাগ
2759,ডঃ মোঃ নাছিম আহমেদ দেওয়ান,সহযোগী অধ্যাপক,তড়িৎ ও ইলেকঃ কৌশল বিভাগ
2760,ডঃ নেওয়াজ মুহম্মদ সাইফুর রহিম,সহযোগী অধ্যাপক,তড়িৎ ও ইলেকঃ কৌশল বিভাগ
2761,ডঃ মোঃ মনিরুল ইসলাম,সহযোগী অধ্যাপক,সি.এস.ই বিভাগ
2762,ডঃ এ. কে. এম. জহির উদ্দিন চৌধুরী,অধ্যাপক,"আই.ডব্লিউ.এফ.এম
ডঃ মোঃ মোজাম্মেল হক"
2763,ডঃ ইকবাল মাহমুদ,অধ্যাপক,যন্ত্রকৌশল বিভাগ
2764,ডঃ এম আনোয়ারুল য়াজীম,অধ্যাপক,ইন্ডাষ্ট্রিয়াল এন্ড প্রোডাকশন ইঞ্জিনিয়ারিং বিভাগ
2765,ডঃ এ বি এম সিদ্দিক হোসেন,সহযোগী অধ্যাপক,তড়িৎ ও ইলেকট্রনিক কৌশল বিভাগ
2766,"জনাব এস,এম,শহীদুল্লাহ","ম্যানেজিং ডাইরেক্টর,মেসার্স শহীদুল্লাহ এন্ড এসোসিয়েট লিমিটেড",অন্যান্য
2767,প্রধান প্রকৌশলী,"গণ-পূর্ত বিভাগ,গণ-প্রজাতন্ত্রী বাংলাদেশ সরকার,ঢাকা",অন্যান্য
2768,"ডঃ এ,এম, আজিজুল হক",ডীন,যন্ত্রকৌশল অনুষদ
2769,"ডঃ এ,কে,এম,এ, কাদের",অধ্যাপক,কেমিকৌশল বিভাগ
2770,"ডঃ এ,এস, ওয়াইস কারণী",সহযোগী অধ্যাপক,বস্তু ও ধাতব কৌশল বিভাগ
2771,"জনাব এস,এম,শহীদুল্লাহ","ম্যানেজিং ডাইরেক্টর,মেসার্স শহীদুল্লাহ এন্ড এসোঃ লিঃ",অন্যান্য
2772,ডঃ বেলাল আহমেদ,সহযোগী অধ্যাপক,যন্ত্রকৌশল বিভাগ
2773,মিসেস খালেদা রশিদ,সহযোগী অধ্যাপক,স্থাপত্য বিভাগ
2774,ডঃ ইনামুল বাশার,সহযোগী অধ্যাপক,তড়িৎ ও ইলেকট্রনিক কৌশল বিভাগ
2775,সভাপতি,"সভাপতি,বাংলাদেশ ইনষ্টিটিউট অফ ইন্জিঃ,ঢাকা",অন্যান্য
2776,ডঃ সৈয়দ ফাজলে রহমান,ডীন,তড়িৎ ও ইলেকট্রনিক কৌশল অনুষদ
2777,ডঃ মোঃ আলী মুর্তজা,অধ্যাপক,পুরকৌশল বিভাগ
2778,জনাব আবু হায়দার ইমাম উদ্দিন,সহযোগী অধ্যাপক,যন্ত্রকৌশল বিভাগ
2779,ডঃ মোঃ আবদুর রাজ্জাক আকন্দ,সহযোগী অধ্যাপক,"যন্ত্রকৌশল বিভা
ডঃ মোঃ মনোয়ারুল ইসলাম"
2417,ডঃ মোঃ ওয়াহাজ  উদ্দিন,অধ্যাপক,যন্ত্রকৌশল বিভাগ
2419,ডঃ কাজী মহিউদ্দিন আহমেদ,সহযোগী অধ্যাপক,তড়িৎ ও ইলেক ট্রনিক কৌশল বিভাগ
2420,ডঃ আবু ফজল মোঃ সালেহ,"রিসার্চ সহযোগী অধ্যাপক (আই,এফ,সি,ডি,আর)",অন্যান্য
2421,ডঃ মোঃ শহিদুল ‌আমিন,সহযোগী অধ্যাপক,স্থাপত্য বিভাগ
2422,"ডঃ এস, শাহনেওয়াজ আহমোদ",সহযোগী অধ্যাপক,তড়িৎ ও ইলেক ট্রনিক কৌশল বিভাগ
2431,ডঃ ইকবাল মাহমুদ,পধান,কেমিকৌশল  বিভাগ
2432,ডঃ ইজাজ হোসেন,প্রধান,"পেট্রোলিয়াম এন্ড মিনারেল রিসোর্সেস ইঞ্জিঃ
ডঃ আজাদুর রহমান"
2434,ডঃ মোঃ মনোয়ারুর ইসলাম,সহযোগী প্রফেসর,রসায়ন বিভাগ
2435,ডঃ এ.কে.এম. মতিউর রহমান,সহযোগী প্রফেসর,রসায়ন বিভাগ
2436,ডঃ মোঃ রফিকউল্ল্যাহ,সহযোগী প্রফেসর,রসায়ন বিভাগ
2437,ডঃ মোস্তফা কামাল চৌধুরী,সহযোগী প্রফেসর,গণিত বিভাগ
2438,ডঃ  মোঃ আবু হাসান ভূইয়া,সহযোগী প্রফেসর,পদার্থ বিজ্ঞান বিভাগ
2439,ডঃ ফারুক আহমেদ,প্রফেসর,পুরকৌশল বিভাগ
2440,ডঃ এ.এম.এম. তৌফীকুল আনোয়ার,প্রফেসর,পুরকৌশল বিভাগ
2441,ডঃ মোঃ শফিউল বারী,প্রফেসর,পুরকৌশল বিভাগ
2442,ডঃ সালেক মোঃ সেরাজ,সহযোগী প্রফেসর,পুরকৌশল বিভাগ
2443,ডঃ মোঃ আবদুল জলিল,সহযোগী প্রফেসর,পুরকৌশল বিভাগ
2444,ডঃ ইশতিয়াক আহমেদ,সহযোগী প্রফেসর,পুরকৌশল বিভাগ
2445,ডঃ মোঃ  জাকারিয়া আহম্মদ,সহযোগী প্রফেসর,পুরকৌশল বিভাগ
2446,ডঃ মোঃ সামছুল হক,সহযোগী প্রফেসর,পুরকৌশল বিভাগ
2447,প্রফেসর ডঃ মোহাম্মদ আলী ভুঁইয়া,প্রফেসর,পানি সম্পদ কৌশল বিভাগ
2448,ডঃ শওকত জাহান চৌধুরী,প্রফেসর,যন্ত্রকৌশল বিভাগ
2449,ডঃ মোঃ আঃ রশীদ সরকার,প্রফেসর,যন্ত্রকৌশল বিভাগ
2450,ডঃ মোঃ মাহবুবুল  আলম,সহযোগী প্রফেসর,যন্ত্রকৌশল বিভাগ
2451,ডঃ মোঃ মাকসুদ হেলালী,সহযোগী প্রফেসর,যন্ত্রকৌশল বিভাগ
2452,"ডঃ এ,কে, মেসবাহউদ্দিন",সহযোগী প্রফেসর,যন্ত্রকৌশল বিভাগ
2453,ডঃ মোঃ রেফায়েত উল্লাহ,সহযোগী প্রফেসর,নৌযান ও নৌযন্ত্র কৌশল বিভাগ
2454,জনাব আবদুর রহীম,সহযোগী প্রফেসর,নৌযান ও নৌযন্ত্র কৌশল বিভাগ
2476,ডঃ মোঃ দেলওয়ার হোসেন,সহযোগী প্রফেসর,পুরকৌশল বিভাগ
2477,ডঃ মাগলুব-আল-নুর,সহযোগী প্রফেসর,যন্ত্রকৌশল বিভাগ
2478,ডঃ জামাল আবদুন নাসের,সহযোগী প্রফেসর,যন্ত্রকৌশল বিভাগ
2479,ডঃ আমিনুল হক,প্রফেসর,তড়িৎ ও ইলেক ট্রনিক কৌশল বিভাগ
2480,ডঃ মোঃ সামসুল আলম,প্রফেসর,কম্পিউটার সায়েন্স এন্ড ইন্ঞ্জিনিয়ারিং বিভাগ
2481,জনাব খায়রুল এনাম,প্রফেসর,স্থাপত্য বিভাগ
2482,ডঃ মোঃ মোজ্জামেল হক,গবেষণাপ্রফেসর,পানি ও বন্যা ব্যবস্থাপনা বিভাগ
2501,ডঃ এম আর কবীর,সহযোগী প্রফেসর,পানি সম্পদ কৌশল বিভাগ
2508,ডঃ দিল আফরোজা বেগম,প্রফেসর,কেমিকৌশল বিভাগ
2509,ডঃ মহিউদ্দিন আহমেদ,সহযোগী প্রফেসর,ইন্ডাষ্ট্রিয়াল এন্ড প্রোডাকশন ইঞ্জিনিয়ারিং বিভাগ
2510,"ডঃ এম, মাইনুল হক",গবেষণা সহযোগী প্রফেসর,
2511,প্রফেসর ডঃ ইকবাল মাহমুদ,উপাচার্য,"উপাচার্য
ডঃ এ, কে, এম, আঃ কাদের"
2512,প্রফেসর ডঃ ফারুক আহমদ উল্লা খান,ডীন,স্থাপত্য ও পরিকল্পনা অনুষদ
2513,ডঃ এম. ফিরোজ আহমেদ,ডীন,পুরকৌশল অনুষদ
2514,ডঃ অমলেস চন্দ্র মন্ডল,ডীন,যন্ত্রকৌশল অনুষদ
2424,"ডঃ এ,কে,এম, আব্দুল মোক্তাদির",সহযোগী অধ্যাপক,পুরকৌশল বিভাগ
2425,ডঃ মোঃ জহুরুল ইসলাম,সহযোগী অধ্যাপক,"আই,এফ,সি,ডি,আর"
2426,ডঃ মোঃ জহরুল ইসলাম,গবেষণা সহযোগী অধ্যাপক,"আই,এফ,সি,ডি,আর"
2427,ডঃ মোঃ রেজাউর রহমান,গবেষণা সহযোগী অধ্যাপক,"আই,এফ,সি,ডি,আর"
2428,ডঃ এম আর কবীর,সহযোগী অধ্যাপক,পানি সম্পদ কৌশল বিভাগ
2429,ডঃ মোহাম্মদ মাহবুবুর রহমান,সহযোগী অধ্যাপক,স্থাপত্য বিভাগ
2430,ডঃ জেবুন নাসরীন আহমেদ,সহযোগী প্রফেসর,স্থাপত্য বিভাগ
2455,"ডঃ এ,কে,এম, নুরুল আমিন",প্রফেসর,ইন্ডাষ্ট্রিয়াল এন্ড প্রোডাকশন ইঞ্জিনিয়ারিং বিভাগ
2456,ডঃ এম.এম. শহিদুল হাসান,প্রফেসর,তড়িৎ ও ইলেক ট্রনিক কৌশল বিভাগ
2457,ডঃ মুহাঃ রিজওয়ান খান,প্রফেসর,তড়িৎ ও ইলেক ট্রনিক কৌশল বিভাগ
2458,ডঃ সৈয়দ মাহফুজুল আজিজ,সহযোগী প্রফেসর,তড়িৎ ও ইলেক ট্রনিক কৌশল
2459,ডঃ মশিউর রহমান,সহযোগী প্রফেসর,তড়িৎ ও ইলেক ট্রনিক কৌশল বিভাগ
2460,ডঃ সাইফুর রহমান,সহযোগী প্রফেসর,তড়িৎ ও ইলেক ট্রনিক কৌশল বিভাগ
2461,ডঃ প্রান কানাই সাহা,সহযোগী প্রফেসর,তড়িৎ ও ইলেক ট্রনিক কৌশল বিভাগ
2462,ডঃ মোঃ কায়কোবাদ,সহযোগী প্রফেসর,কম্পিউটার সায়েন্স এন্ড ইন্ঞ্জিনিয়ারিং বিভাগ
2463,ডঃ নিজাম উদ্দিন আহমেদ,সহযোগী প্রফেসর,স্থাপত্য বিভাগ
2464,ডঃ মোহাম্মদ মাহবুবুর রহমান,সহযোগী প্রফেসর,স্থাপত্য বিভাগ
2465,"ডঃ এ.এস.এম, আব্দুল কাইয়ুম",প্রফেসর,নগর ও অঞ্চল পরিকল্পনা বিভাগ
2466,"ডঃ এম,এ মোহিত",সহযোগী প্রফেসর,নগর ও অঞ্চল পরিকল্পনা বিভাগ
2467,প্রফেসর ডঃ সারওয়ার জাহান,সহযোগী প্রফেসর,নগর ও অঞ্চল পরিকল্পনা বিভাগ
2468,"ডঃ এ,কে,এম,জহির  উদ্দিন চৌধুরী",গবেষণা প্রফেসর,"আই,এফ,সি,ডি,আর"
2469,ডঃ মোঃ জহুরুল ইসলাম,সহযোগী প্রফেসর,"আই,এফ,সি,ডি,আর"
2470,ডঃ মোঃ নুরুল ইসলাম,গবেষণা প্রফেসর,
2471,"ডঃ এম, মাইনুল হক",গবেষণা সহযোগী প্রফেসর,
2472,ডঃ নজরুল ইসলাম,"ভাইস চেয়ারম্যান,কাউন্সিল অব ইনস্টিটিউট বি,আই,টি,ধানমন্ডি,ঢাকা",অন্যান্য
2473,ডঃ ইজাজ হোসেন,প্রধান,"পেট্রোলিয়াম এন্ড মিনারেল রিসোর্সেস ইঞ্জিঃ
ডঃ মোঃ মনোয়ার হোসেন"
2474,"প্রফেসর ডঃ এ,এস,এম আবদুল হাছিব",সহযোগী প্রফেসর,বস্তু ও ধাতব কৌশল বিভাগ
2475,ডঃ নজরুল ইসলাম,সহযোগী প্রফেসর,রসায়ন বিভাগ
2483,"ডঃ এ,এম আনোয়ারুল আজিম",প্রধান,ইন্ডাষ্ট্রিয়াল এন্ড প্রোডাকশন ইঞ্জিনিয়ারিং বিভাগ
2484,ডঃ মোঃ কামরুল আহসান,প্রধান,তড়িৎ ও ইলেক ট্রনিক কৌশল বিভাগ
2485,ডঃ মোহাম্মদ হানিফ সিদ্দিকা,সহযোগী প্রফেসর,কেমিকৌশল বিভাগ
2486,"ডঃ এ.বি.এম, সিদ্দিক হোসেন",প্রফেসর,তড়িৎ ও ইলেক ট্রনিক কৌশল বিভাগ
2487,ডঃ মোঃ আব্দুল মতিন,প্রফেসর,তড়িৎ ও ইলেক ট্রনিক কৌশল বিভাগ
2488,ডঃ সত্য প্রসাদ মজুমদার,প্রফেসর,তড়িৎ ও ইলেক ট্রনিক কৌশল বিভাগ
2489,"জনাব এ,এস,এম,মাহবুবু উন নবী",সহযোগী প্রফেসর,নগর ও অঞ্চল পরিকল্পনা বিভাগ
2490,ডঃ মোঃ রেজাউর রহমান,গবেষণা সহযোগী প্রফেসর,"আই,এফ,সি,ডি,আর"
2491,ডঃ মোঃ নুরুল ইসলাম,গবেষণা প্রফেসর,
2492,চেয়ারম্যান,"বিদ্যুৎ উন্নয়ন বোর্ড,ওয়াপদা ভবন, মতিঝিল,ঢাকা",অন্যান্য
2493,ডঃ নুরউদ্দিন আহমেদ,প্রধান,কেমি কৌশল বিভাগ
2494,ডঃ মোঃ কায়কোবাদ,প্রধান,কম্পিউটার সায়েন্স এন্ড ইন্ঞ্জিনিয়ারিং বিভাগ
2495,"ডঃ এ,এস,এম আবদুল কাইয়ুম",প্রধান,নগর ও অঞ্চল পরিকল্পনা বিভাগ
2496,ডঃ ইজাজ হোসেন,সহযোগী প্রফেসর,কেমিকৌশল বিভাগ
2497,ডঃ শেখ সেকেন্দার আলী,প্রফেসর,পুরকৌশল বিভাগ
2498,ডঃ মোঃ হাবিবুর রহমান,সহযোগী প্রফেসর,পুরকৌশল বিভাগ
2499,ডঃ মোঃ শফিউল বারী,সহযোগী প্রফেসর,পুরকৌশল বিভাগ
2500,প্রফেসর ডঃ মোহাম্মদ আলী ভুঁইয়া,সহযোগী প্রফেসর,পানি সম্পদ কৌশল বিভাগ
2502,ডঃ আমিনুল হক,সহযোগী প্রফেসর,তড়িৎ ও ইলেক ট্রনিক কৌশল বিভাগ
2503,ডঃ সত্য প্রসাদ মজুমদার,সহযোগী প্রফেসর,তড়িৎ ও ইলেক ট্রনিক কৌশল বিভাগ
2504,প্রফেসর ডঃ মোঃ সামসুল আলম,প্রফেসর,কম্পিউটার সায়েন্স এন্ড ইন্ঞ্জিনিয়ারিং বিভাগ
2791,"ডঃ আ, ফ, ম, আনওয়ারুল হক",অধ্যাপক,"আই, পি, ই, বিভাগ"
2792,"ডঃ এ, এম, এম, সফিউল্লাহ",অধ্যাপক,পুরকৌশল বিভাগ
2793,ডঃ আইনুন নিশাত,অধ্যাপক,পদার্থ বিজ্ঞান বিভাগ
2794,"ডঃ এ, এস, ওয়াইস কারনী",অধ্যাপক,বস্তু ও ধাতব কৌশল বিভাগ
2795,"ডঃ এ, এ, মোঃ রেজাউল হক",অধ্যাপক,বস্তু ও ধাতব কৌশল বিভাগ
2796,"ডঃ এ, কে, এম, সদরুল ইসলাম",অধ্যাপক,যন্ত্রকৌশল বিভাগ
2797,ডঃ মোঃ শহীদুল ইসলাম খান,অধ্যাপক,তড়িৎ ও ইলেকট্রনিক কৌশল বিভাগ
2798,ডঃ মোঃ আলী আশরাফ,অধ্যাপক,গণিত বিভাগ
2799,"ডঃ এ, কে, এম, নূরুল আমিন",সহযোগী অধ্যাপিকা,"আই, পি, ই, বিভাগ"
2800,ডঃ আহসান আলী খান,সহযোগী অধ্যাপক,"আই, পি, ই, বিভাগ"
2801,"ডঃ এস, এম, লুৎফুল কবীর",সহযোগী অধ্যাপক,তড়িৎ ও ইলেকট্রনিক কৌশল বিভাগ
2802,ডঃ মোঃ রুহুল আমিন সরকার,সহযোগী অধ্যাপক,"আই, পি, ই বিভাগ"
2837,Dean,ডিন,প্রকৌশল অনুষদ
2838,Profeesor and Head,প্রধান,পুরকৌশল বিভাগ
2839,Profeesor and Head,প্রধান,তড়িৎ ও ইলেকট্রনিক কৌশল বিভাগ
2840,Head,প্রধান,কেমিকৌশল বিভাগ
2841,Head,প্রধান,বস্তু ও ধাতব কৌশল বিভাগ
2842,Head,প্রধান,পদার্থ বিজ্ঞান বিভাগ
2843,Head,প্রধান,রসায়ন বিভাগ
2844,Head,প্রধান,গণিত বিভাগ
2845,Director,Director,ছাত্র কল্যাণ পরিদপ্তর
2846,Director,Director,"উপদেশ, প্রসারন ও গবেষণা কার্যক্রম পরিদপ্তর"
2847,Dr. Zahoorul Haque,অধ্যাপক,তড়িৎ ও ইলেকট্রনিক কৌশল বিভাগ
2848,Mr. R. Ahmed,সহযোগী অধ্যাপক,যন্ত্রকৌশল বিভাগ
2849,Mr. Syed Karim Ali,সহযোগী অধ্যাপক,যন্ত্রকৌশল বিভাগ
2859,অধ্যাপক  ডঃ মোহাম্মদ তামিম,প্রধান,"পেট্রোলিয়াম এন্ড 
অধ্যাপক ডঃ মোঃ মাজহারুল হক"
2860,জনাব সৈয়দ নূর-উদ্‌-দীন আহমদ,সহযোগী অধ্যাপক,পুরকৌশল বিভাগ
2861,ডঃ এম.এম. শহিদুল হাসান,অধ্যাপক,তড়িৎ ও ইলেকঃ কৌশল বিভাগ
2862,ডঃ এ.বি.এম. হারুন-উর-রশিদ,সহযোগী অধ্যাপক,তড়িৎ ও ইলেকঃ কৌশল বিভাগ
2863,ডঃ মোঃ শাহ্‌ আলম,সহযোগী অধ্যাপক,তড়িৎ ও ইলেকঃ কৌশল বিভাগ
2864,ডঃ মোঃ মোজাম্মেল হক,অধ্যাপক,আই.ডব্লিউ.এফ.এম
2865,অধ্যাপক ডঃ সাইয়াদ সালেহীন কাদরী,"ডীন, জীববিজ্ঞান অনুষদ,ঢাকা বিশ্ববিদ্যালয়",অন্যান্য
2866,ডঃ এ এম আজিজ উল হক,ডীন,যন্ত্রকৌশল অনুষদ
2867,ডীন,"ডীন,তড়িৎ ও ইলেকট্রনিক কৌশল অনুষদ",তড়িৎ ও ইলেকট্রনিক কৌশল অনুষদ
2868,ডঃ গিয়াস উদ্দীন আহমেদ,অধ্যাপক,পদার্থ বিজ্ঞান বিভাগ
2869,ডঃ এম ফিরোজ আহমদ,অধ্যাপক,পুরকৌশল বিভাগ
2870,ডঃ এ এম এম শফিউল্লাহ,অধ্যাপক,পুরকৌশল বিভাগ
2871,ডঃ মোঃ খুরশিদ আলম,অধ্যাপক,তড়িৎ ও ইলেকট্রনিক কৌশল বিভাগ
2872,ডঃ কে ইখতিয়ার ওমর,অধ্যাপক,কেমিকৌশল বিভাগ
2873,জনাব এ এ এম মাহবুব উন নবী,সহযোগী অধ্যাপক,নগর ও অঞ্চল পরিকল্পনা বিভাগ
2874,ডঃ মোঃ তফাজ্জল হোসেন,সহযোগী অধ্যাপক,পদার্থ বিজ্ঞান বিভাগ
2875,ডঃ এ এস ওয়াইস কারনী,সহযোগী অধ্যাপক,বস্তু ও ধাতব কৌশল বিভাগ
2876,ডঃ মনিমুল হক,সহযোগী অধ্যাপক,রসায়ন বিভাগ
2877,পরিচালক,"পরিচালক ,কম্পিউটার সেন্টার",অন্যন্য
2893,ডঃ এম ফিরোজ আহমেদ,ডীন,পুরকৌশল বিভাগ
2894,ডঃ মোঃ মীজানুর রহমান,ডীন,যন্ত্রকৌশল বিভাগ
2895,ডঃ দিল আফরোজ বেগম,প্রধান,কেমিকৌশল বিভাগ
2896,ডঃ ইং এম আনোয়ারুল য়াজীম,প্রধান,ইন্ডাষ্ট্রিয়াল এন্ড প্রোডাকশন ইঞ্জিনিয়ারিং বিভাগ
2897,ডঃ এ.এস.এম.এ.হাসীব,সহযোগী অধ্যাপক,বস্তু ও ধাতব কৌশল বিভাগ
2898,ডঃ ফখরুল ইসলাম,সহযোগী অধ্যাপক,রসায়ন বিভাগ
2899,ডঃ আবদুর মোক্তাদির,অধ্যাপক,পুরকৌশল বিভাগ
